{
  "testId": "source-quality-ci",
  "status": "PASS",
  "scope": "integration",
  "sourceRevision": "f34b7719e6838bd439d6c9e38400b395589f4465",
  "lockfileSha256": "26134ea4a7f4a40dd6df5d04451f15603e30e6d972b761c9bfe639490841de3d",
  "method": "GitHub Actions Source quality: locked install, complete source tests, full audit, build and Chromium browser suite",
  "environment": "isolated_ci",
  "startedAt": "2026-10-20T12:15:37Z",
  "finishedAt": "2026-10-20T12:17:27Z",
  "evidenceRefs": [
    "https://github.com/sorensadrgit-art/Soren-MCP_1/actions/runs/39420898619",
    "https://github.com/sorensadrgit-art/Soren-MCP_1/actions/runs/39420898619/job/118621268633",
    "docs/evidence/source-quality-summary.txt"
  ],
  "observed": {
    "runId": 39420898619,
    "jobId": 118621268633,
    "conclusion": "success",
    "node": "22.23.3",
    "platform": "ubuntu-latest",
    "unit": {
      "tests": 151,
      "passed": 149,
      "failed": 0,
      "skipped": 2,
      "skipReason": "Windows-only denied-DACL and active-sharing-lock cases; both pass in local Windows run"
    },
    "browser": {
      "passed": 32,
      "failed": 0
    },
    "auditVulnerabilities": 0,
    "jobs": [
      {
        "name": "native-postgres",
        "id": 118621268051,
        "conclusion": "success",
        "url": "https://github.com/sorensadrgit-art/Soren-MCP_1/actions/runs/39420898619/job/118621268051"
      },
      {
        "name": "checks",
        "id": 118621268633,
        "conclusion": "success",
        "url": "https://github.com/sorensadrgit-art/Soren-MCP_1/actions/runs/39420898619/job/118621268633"
      }
    ],
    "steps": [
      {
        "name": "Set up job",
        "conclusion": "success"
      },
      {
        "name": "Run actions/checkout@11d5960a326750d5838078e36cf38b85af677262",
        "conclusion": "success"
      },
      {
        "name": "Run actions/setup-node@49933ea5288caeca8642d1e84afbd3f7d6820020",
        "conclusion": "success"
      },
      {
        "name": "Run npm ci --ignore-scripts",
        "conclusion": "success"
      },
      {
        "name": "Run npm test",
        "conclusion": "success"
      },
      {
        "name": "Run npm audit",
        "conclusion": "success"
      },
      {
        "name": "Run npm run build",
        "conclusion": "success"
      },
      {
        "name": "Run npx playwright install --with-deps chromium",
        "conclusion": "success"
      },
      {
        "name": "Run npm run test:browser",
        "conclusion": "success"
      },
      {
        "name": "Run actions/upload-artifact@ea165f8d65b6e75b540449e92b4886f43607fa02",
        "conclusion": "success"
      },
      {
        "name": "Post Run actions/setup-node@49933ea5288caeca8642d1e84afbd3f7d6820020",
        "conclusion": "success"
      },
      {
        "name": "Post Run actions/checkout@11d5960a326750d5838078e36cf38b85af677262",
        "conclusion": "success"
      },
      {
        "name": "Complete job",
        "conclusion": "success"
      }
    ]
  }
}
